{
  "schema_version": "1.4.0",
  "generated_at": "2026-04-01T05:08:08Z",
  "generator": "nuguard",
  "target": "/Users/ganesh/work/nuguard/stock-assist",
  "nodes": [
    {
      "id": "693074a7-2c40-448a-a522-a20ca9ee73c5",
      "name": "clear_all_chats",
      "component_type": "API_ENDPOINT",
      "confidence": 0.9,
      "metadata": {
        "framework": "flask",
        "endpoint": "/api/chats/clear_all",
        "method": "DELETE",
        "request_body_schema": {},
        "chat_payload_list": false,
        "extras": {
          "canonical_name": "flask_endpoint_delete_api_chats_clear_all",
          "adapter": "flask",
          "evidence_count": 1,
          "framework": "flask",
          "method": "DELETE",
          "endpoint": "/api/chats/clear_all"
        }
      },
      "evidence": [
        {
          "kind": "ast",
          "confidence": 0.9,
          "detail": "flask: @app.route('/api/chats/clear_all')",
          "location": {
            "path": "routes.py",
            "line": 1201
          }
        }
      ]
    },
    {
      "id": "2893cf60-b37f-46bc-9a60-7efe9de46b38",
      "name": "delete_chat",
      "component_type": "API_ENDPOINT",
      "confidence": 0.9,
      "metadata": {
        "framework": "flask",
        "endpoint": "/api/chats/<int:chat_id>",
        "method": "DELETE",
        "request_body_schema": {},
        "chat_payload_list": false,
        "extras": {
          "canonical_name": "flask_endpoint_delete_api_chats_int_chat_id",
          "adapter": "flask",
          "evidence_count": 1,
          "framework": "flask",
          "method": "DELETE",
          "endpoint": "/api/chats/<int:chat_id>"
        }
      },
      "evidence": [
        {
          "kind": "ast",
          "confidence": 0.9,
          "detail": "flask: @app.route('/api/chats/<int:chat_id>')",
          "location": {
            "path": "routes.py",
            "line": 1152
          }
        }
      ]
    },
    {
      "id": "58775e0f-c22b-4b2f-981b-786fa1e882af",
      "name": "index",
      "component_type": "API_ENDPOINT",
      "confidence": 0.9,
      "metadata": {
        "framework": "flask",
        "endpoint": "/",
        "method": "GET",
        "request_body_schema": {},
        "chat_payload_list": false,
        "extras": {
          "canonical_name": "flask_endpoint_get",
          "adapter": "flask",
          "evidence_count": 1,
          "framework": "flask",
          "method": "GET",
          "endpoint": "/"
        }
      },
      "evidence": [
        {
          "kind": "ast",
          "confidence": 0.9,
          "detail": "flask: @app.route('/')",
          "location": {
            "path": "routes.py",
            "line": 476
          }
        }
      ]
    },
    {
      "id": "5e96545b-0142-4360-96f5-b02bf638134d",
      "name": "admin_keys",
      "component_type": "API_ENDPOINT",
      "confidence": 0.9,
      "metadata": {
        "framework": "flask",
        "endpoint": "/admin/keys",
        "method": "GET",
        "request_body_schema": {},
        "chat_payload_key": "subscription_id",
        "chat_payload_list": false,
        "extras": {
          "canonical_name": "flask_endpoint_get_admin_keys",
          "adapter": "flask",
          "evidence_count": 1,
          "framework": "flask",
          "method": "GET",
          "endpoint": "/admin/keys",
          "chat_payload_key": "subscription_id"
        }
      },
      "evidence": [
        {
          "kind": "ast",
          "confidence": 0.9,
          "detail": "flask: @app.route('/admin/keys')",
          "location": {
            "path": "routes.py",
            "line": 1393
          }
        }
      ]
    },
    {
      "id": "7d43037c-e33e-46e7-be72-e51f9831026b",
      "name": "get_chat_image",
      "component_type": "API_ENDPOINT",
      "confidence": 0.9,
      "metadata": {
        "framework": "flask",
        "endpoint": "/api/chat/image/<int:image_id>",
        "method": "GET",
        "request_body_schema": {},
        "chat_payload_list": false,
        "extras": {
          "canonical_name": "flask_endpoint_get_api_chat_image_int_image_id",
          "adapter": "flask",
          "evidence_count": 1,
          "framework": "flask",
          "method": "GET",
          "endpoint": "/api/chat/image/<int:image_id>"
        }
      },
      "evidence": [
        {
          "kind": "ast",
          "confidence": 0.9,
          "detail": "flask: @app.route('/api/chat/image/<int:image_id>')",
          "location": {
            "path": "routes.py",
            "line": 1310
          }
        }
      ]
    },
    {
      "id": "8a3c13ab-5783-451c-b193-374ab7e94bb5",
      "name": "get_chat_status",
      "component_type": "API_ENDPOINT",
      "confidence": 0.9,
      "metadata": {
        "framework": "flask",
        "endpoint": "/api/chat/status/<operation_id>",
        "method": "GET",
        "request_body_schema": {},
        "chat_payload_list": false,
        "extras": {
          "canonical_name": "flask_endpoint_get_api_chat_status_operation_id",
          "adapter": "flask",
          "evidence_count": 1,
          "framework": "flask",
          "method": "GET",
          "endpoint": "/api/chat/status/<operation_id>"
        }
      },
      "evidence": [
        {
          "kind": "ast",
          "confidence": 0.9,
          "detail": "flask: @app.route('/api/chat/status/<operation_id>')",
          "location": {
            "path": "routes.py",
            "line": 894
          }
        }
      ]
    },
    {
      "id": "fb5bd61f-4bc6-4b62-8c22-c76a4ae86c3d",
      "name": "get_chats",
      "component_type": "API_ENDPOINT",
      "confidence": 0.9,
      "metadata": {
        "framework": "flask",
        "endpoint": "/api/chats",
        "method": "GET",
        "request_body_schema": {},
        "chat_payload_list": false,
        "extras": {
          "canonical_name": "flask_endpoint_get_api_chats",
          "adapter": "flask",
          "evidence_count": 1,
          "framework": "flask",
          "method": "GET",
          "endpoint": "/api/chats"
        }
      },
      "evidence": [
        {
          "kind": "ast",
          "confidence": 0.9,
          "detail": "flask: @app.route('/api/chats')",
          "location": {
            "path": "routes.py",
            "line": 927
          }
        }
      ]
    },
    {
      "id": "43d58591-8a74-47ce-9bbd-9288966eaed1",
      "name": "get_chat_messages",
      "component_type": "API_ENDPOINT",
      "confidence": 0.9,
      "metadata": {
        "framework": "flask",
        "endpoint": "/api/chats/<int:chat_id>",
        "method": "GET",
        "request_body_schema": {},
        "chat_payload_list": false,
        "extras": {
          "canonical_name": "flask_endpoint_get_api_chats_int_chat_id",
          "adapter": "flask",
          "evidence_count": 1,
          "framework": "flask",
          "method": "GET",
          "endpoint": "/api/chats/<int:chat_id>"
        }
      },
      "evidence": [
        {
          "kind": "ast",
          "confidence": 0.9,
          "detail": "flask: @app.route('/api/chats/<int:chat_id>')",
          "location": {
            "path": "routes.py",
            "line": 981
          }
        }
      ]
    },
    {
      "id": "d2362291-6bbd-4e14-b8cb-e06ce38acf28",
      "name": "get_admin_metrics",
      "component_type": "API_ENDPOINT",
      "confidence": 0.9,
      "metadata": {
        "framework": "flask",
        "endpoint": "/api/metrics/admin",
        "method": "GET",
        "request_body_schema": {},
        "chat_payload_list": false,
        "extras": {
          "canonical_name": "flask_endpoint_get_api_metrics_admin",
          "adapter": "flask",
          "evidence_count": 1,
          "framework": "flask",
          "method": "GET",
          "endpoint": "/api/metrics/admin"
        }
      },
      "evidence": [
        {
          "kind": "ast",
          "confidence": 0.9,
          "detail": "flask: @app.route('/api/metrics/admin')",
          "location": {
            "path": "routes.py",
            "line": 1279
          }
        }
      ]
    },
    {
      "id": "38956fd9-5ae6-4ffa-a9c8-dff9aaf43eb8",
      "name": "get_usage_metrics",
      "component_type": "API_ENDPOINT",
      "confidence": 0.9,
      "metadata": {
        "framework": "flask",
        "endpoint": "/api/metrics/usage",
        "method": "GET",
        "request_body_schema": {},
        "chat_payload_list": false,
        "extras": {
          "canonical_name": "flask_endpoint_get_api_metrics_usage",
          "adapter": "flask",
          "evidence_count": 1,
          "framework": "flask",
          "method": "GET",
          "endpoint": "/api/metrics/usage"
        }
      },
      "evidence": [
        {
          "kind": "ast",
          "confidence": 0.9,
          "detail": "flask: @app.route('/api/metrics/usage')",
          "location": {
            "path": "routes.py",
            "line": 1243
          }
        }
      ]
    },
    {
      "id": "1a9d0af5-ca2d-4c5d-a365-9b35c268686e",
      "name": "get_news_item",
      "component_type": "API_ENDPOINT",
      "confidence": 0.9,
      "metadata": {
        "framework": "flask",
        "endpoint": "/api/news/<int:news_id>",
        "method": "GET",
        "request_body_schema": {},
        "chat_payload_list": false,
        "extras": {
          "canonical_name": "flask_endpoint_get_api_news_int_news_id",
          "adapter": "flask",
          "evidence_count": 4,
          "framework": "flask",
          "method": "GET",
          "endpoint": "/api/news/<int:news_id>"
        }
      },
      "evidence": [
        {
          "kind": "ast",
          "confidence": 0.9,
          "detail": "flask: @news_bp.route('/api/news/<int:news_id>')",
          "location": {
            "path": "routes/news.py",
            "line": 51
          }
        },
        {
          "kind": "ast",